{"min_bike_id_coverage":0.99,"series":[{"system_id":"tor-bikeshare","era_first_year":2019,"era_last_year":2026,"year":2019,"months":12,"intervals":2288341,"relocated":150674,"out_of_order":23,"on_hour_grid":69245,"p25_s":1440,"median_s":7080,"p75_s":34380},{"system_id":"tor-bikeshare","era_first_year":2019,"era_last_year":2026,"year":2020,"months":12,"intervals":2750335,"relocated":159403,"out_of_order":7,"on_hour_grid":167861,"p25_s":840,"median_s":6000,"p75_s":38400},{"system_id":"tor-bikeshare","era_first_year":2019,"era_last_year":2026,"year":2021,"months":12,"intervals":3340973,"relocated":232166,"out_of_order":4,"on_hour_grid":202539,"p25_s":1020,"median_s":5880,"p75_s":32340},{"system_id":"tor-bikeshare","era_first_year":2019,"era_last_year":2026,"year":2022,"months":12,"intervals":4340040,"relocated":279032,"out_of_order":7,"on_hour_grid":194319,"p25_s":1020,"median_s":4680,"p75_s":22800},{"system_id":"tor-bikeshare","era_first_year":2019,"era_last_year":2026,"year":2023,"months":12,"intervals":5323883,"relocated":386187,"out_of_order":8,"on_hour_grid":203381,"p25_s":1140,"median_s":4800,"p75_s":22380},{"system_id":"tor-bikeshare","era_first_year":2019,"era_last_year":2026,"year":2024,"months":12,"intervals":6514520,"relocated":427434,"out_of_order":13,"on_hour_grid":1167,"p25_s":1048,"median_s":4084,"p75_s":18671},{"system_id":"tor-bikeshare","era_first_year":2019,"era_last_year":2026,"year":2025,"months":12,"intervals":7289663,"relocated":518406,"out_of_order":61,"on_hour_grid":1247,"p25_s":844,"median_s":3264,"p75_s":15056},{"system_id":"tor-bikeshare","era_first_year":2019,"era_last_year":2026,"year":2026,"months":3,"intervals":517869,"relocated":25744,"out_of_order":2,"on_hour_grid":99,"p25_s":2140,"median_s":9708,"p75_s":44777},{"system_id":"van-mobi","era_first_year":2017,"era_last_year":2020,"year":2017,"months":12,"intervals":441296,"relocated":132257,"out_of_order":1,"on_hour_grid":441296,"p25_s":3600,"median_s":10800,"p75_s":50400},{"system_id":"van-mobi","era_first_year":2017,"era_last_year":2020,"year":2018,"months":12,"intervals":566006,"relocated":166363,"out_of_order":1,"on_hour_grid":566005,"p25_s":3600,"median_s":10800,"p75_s":50400},{"system_id":"van-mobi","era_first_year":2017,"era_last_year":2020,"year":2019,"months":12,"intervals":719003,"relocated":172084,"out_of_order":6,"on_hour_grid":667548,"p25_s":3600,"median_s":10800,"p75_s":50400},{"system_id":"van-mobi","era_first_year":2017,"era_last_year":2020,"year":2020,"months":12,"intervals":464418,"relocated":105571,"out_of_order":3,"on_hour_grid":464418,"p25_s":3600,"median_s":18000,"p75_s":72000},{"system_id":"van-mobi","era_first_year":2024,"era_last_year":2026,"year":2024,"months":12,"intervals":1043047,"relocated":256130,"out_of_order":330,"on_hour_grid":1043046,"p25_s":3600,"median_s":10800,"p75_s":46800},{"system_id":"van-mobi","era_first_year":2024,"era_last_year":2026,"year":2025,"months":12,"intervals":957932,"relocated":213583,"out_of_order":141,"on_hour_grid":827608,"p25_s":3600,"median_s":10800,"p75_s":46800},{"system_id":"van-mobi","era_first_year":2024,"era_last_year":2026,"year":2026,"months":6,"intervals":442620,"relocated":105859,"out_of_order":2,"on_hour_grid":442620,"p25_s":3600,"median_s":10800,"p75_s":50400}],"withheld":[{"system_id":"tor-bikeshare","year":2016,"trips":585234,"with_bike_id":0,"basis":"no bike identifier published"},{"system_id":"tor-bikeshare","year":2017,"trips":1492293,"with_bike_id":0,"basis":"no bike identifier published"},{"system_id":"tor-bikeshare","year":2018,"trips":1922955,"with_bike_id":0,"basis":"no bike identifier published"},{"system_id":"van-mobi","year":2021,"trips":705146,"with_bike_id":399603,"basis":"bike identifier incomplete"},{"system_id":"van-mobi","year":2022,"trips":975707,"with_bike_id":0,"basis":"no bike identifier published"},{"system_id":"van-mobi","year":2023,"trips":1336567,"with_bike_id":249257,"basis":"bike identifier incomplete"}],"unsupported":{"mtl-bixi":{"supported":false,"reason":"BIXI publishes no bike identifier in ANY era, 2014 through 2026, so consecutive trips of one bike cannot be reconstructed. Verified across the full archive, not inferred.","display":"not published"}},"notes":{"van-mobi":"2017-2020 and 2024-2026 ONLY. bike_id coverage is 56.7% in 2021, 0% in 2022 and 18.6% in 2023; those years are withheld and the gap is stated on the page. Mobi's hour-only timestamps make Vancouver's dwell resolve to whole hours, which the page states beside the figures.","tor-bikeshare":"2019 onward, at 100.0% coverage every year. 2016-2018 publish no bike identifier at all."}}
